Course Link,Course Title,Required IELTS Score,Required PTE Score,Required TOEFL Score,Entry Requirement,Education Level,Course Level,Intake,Duration,Start Date,Degree Format,Location/Campus,Annual Tuition Fee,Initial Deposit,Application Fee,Regional Tax Fee,Overview,Course Structure,Year 1,Year 2,Year 3,Year 4,Year 5,Year 6,Career Opportunity 1,Career Opportunity 2,Career Opportunity 3,Career Opportunity 4,Career Opportunity 5
https://uel.unipd.it/en/masters/peds-special-paediatrics/,Second-level short specialisation degree in Special Paediatrics,6.5,65,80,"To be eligible for this Master's degree, you must hold a Bachelor's degree or equivalent from a recognized institution, accredited by the country's national accreditation system.  Specific curricular requirements for the program must also be met.  For Pakistani students, acceptable qualifications include a 2-year Bachelor (Pass) followed by a 2-year Master's degree; a 2-year Bachelor (Pass) with a Bachelor of Law (LL.B.); a 2-year Bachelor (Pass) with a 3-year Bachelor of Education; a 3-year Bachelor (Honours); or a 4 or 5-year Professional Bachelor.  A minimum GPA of 3.1 out of 4.0 is also required.",Master,Specialisation,"November 18, 2024",One-year,"November 18, 2024",On Campus,Padua,"€2.672,50","€1.672,50",€30,€202,"The Second-level short specialisation degree in Special Paediatrics is a one-year intensive program designed for medical graduates, preferably with pediatric specialization.  It offers advanced training in eight specialized areas of pediatrics: urgency pediatrics, pediatric gastroenterology, pediatric neurology and epileptology, pediatric rheumatology, pediatric onco-hematology, pediatric pulmonology and allergology, pediatric nephrology, and pediatric infectious diseases. The curriculum emphasizes hands-on experience, including bedside practice and participation in the treatment decision-making process, alongside theoretical instruction using real clinical cases.  National and international experts deliver seminars, and students participate in online courses and conferences. The program also includes teaching activities, encouraging students to present clinical cases and literature updates to improve their analytical, critical thinking, and communication skills.  A key element is its focus on practical procedures, such as arthrocentesis, lumbar puncture, and bone marrow aspirate, providing unique hands-on learning opportunities.  Finally, the program integrates clinical research, allowing students to participate in department initiatives, clinical trials, and potentially developing their own research projects culminating in a dissertation.","The course is structured around eight specializations. Each specialization includes theoretical and practical training modules focusing on the diagnosis, treatment, and management of specific pediatric conditions.  The urgency pediatrics module covers emergency room procedures and critical care.  Pediatric gastroenterology focuses on gastrointestinal tract diseases, while pediatric neurology and epileptology covers neurological disorders in children.  Pediatric rheumatology addresses rheumatic diseases, and pediatric onco-hematology focuses on childhood cancers.  Pediatric pulmonology and allergology covers respiratory and allergic conditions.  Pediatric nephrology focuses on renal diseases, and pediatric infectious diseases covers infections in children and adolescents.  In addition to specialized modules, the program includes seminars from experts, online courses, and teaching activities where students present clinical cases or literature reviews. The program culminates in a dissertation, which can be a case report, a literature review, or a pilot study.","The entire program is completed within one year. Students will be exposed to all aspects of the eight specializations, participating in theoretical lectures, practical training sessions, hands-on procedures (under supervision), seminars, and teaching activities where they present their work to peers and faculty.  The year includes various clinical case studies, discussions about relevant research, and the development of a final dissertation project in their chosen specialization.  The learning environment is heavily focused on clinical practice alongside a strong theoretical component.",NA,NA,NA,NA,NA,Pediatric Specialist,Pediatric Emergency Physician,Pediatric Gastroenterologist,Pediatric Oncologist,Pediatric Researcher
https://uel.unipd.it/en/masters/pem-prevention-and-emergency-in-mountain-and-high-altitude-territories/,Master’s Degree in Prevention and Emergency in Mountain and High-Altitude Territories,NA,NA,NA,"To be eligible for this Master's degree, you must hold a Bachelor's degree or equivalent from a recognized institution, accredited according to the country's national system.  Specific curricular requirements may apply.  For Pakistani students, acceptable qualifications include: a 2-year Bachelor (Pass) followed by a 2-year Master's, a 2-year Bachelor (Pass) with a Bachelor of Law (LL.B.), a 2-year Bachelor (Pass) with a 3-year Bachelor of Education, a 3-year Bachelor (Honours), or a 4 or 5-year Professional Bachelor.  A minimum GPA of 3.1 out of 4.0 is also required for Pakistani applicants.",Master,Master,2024/25,One-year,11/11/2024,In-person,Feltre (BL),"€3.022,50","€1.822,50",€30,€202,"The Master’s Degree in Prevention and Emergency in Mountain and High-Altitude Territories is a one-year program designed to train healthcare professionals, focusing on prevention and emergency response in challenging mountain environments. The curriculum blends theoretical knowledge with extensive hands-on field experience.  Students gain expertise in areas such as high-altitude physiology, mountain rescue techniques, meteorology, geology, and risk management.  The program emphasizes a multidisciplinary approach, fostering collaboration among professionals from various fields like healthcare, engineering, and environmental science to address the unique challenges of mountain emergencies. Graduates will be well-prepared to work in various sectors, applying their expertise to protect both the health of individuals and the environment.","The program is structured around 300 hours of classroom lessons and 200 hours of fieldwork across different settings, including emergency rooms, mountain rescue teams, fire brigades, and alpine guide colleges. The curriculum covers a broad spectrum of topics, encompassing high-altitude physiology and pathologies, first aid and rescue techniques, meteorology, geology, risk assessment, emergency response systems, legal liability, and communication strategies for managing crises. The coursework also addresses various occupational hazards within mountain environments and includes simulations and role-playing to enhance practical skills.","The first year of the Master's program provides a comprehensive overview of high-altitude physiology, including adaptation mechanisms, altitude sickness, and related pathologies.  Students learn about mountain emergency response, covering first aid, rescue techniques, and the use of specialized equipment.  The curriculum also incorporates meteorology, geology, risk management, and legal aspects related to mountain operations.  Practical training is conducted in various settings such as emergency rooms, fire stations, and with mountain rescue teams.  Students undertake a research project or dissertation during the final stage of the year.",NA,NA,NA,NA,NA,Mountain Rescue Technician,Emergency Medical Technician,Environmental Risk Assessor,High-Altitude Safety Consultant,Civil Protection Officer
https://uel.unipd.it/en/masters/pisia-innovation-design-and-assessment-of-service-policies-2030-agenda/,"Second-level short specialisation degree in Innovation, Design and Assessment of Service Policies – 2030 Agenda",NA,NA,NA,"To be eligible for admission to a Master's degree, you must have a Bachelor's degree or an equivalent qualification from a recognized higher education institution.  The institution should be accredited according to the national accreditation system of the country where it is located, and you should meet any specific curricular requirements for the program. For Pakistani students, the following qualifications are considered eligible for admission to a Master's degree: a 2-year Bachelor (Pass) followed by a 2-year Master's degree, a 2-year Bachelor (Pass) combined with a Bachelor of Law (LL.B.), a 2-year Bachelor (Pass) combined with a 3-year Bachelor of Education, a 3-year Bachelor (Honours), or a 4 or 5-year Professional Bachelor. Additionally, applicants must have a minimum GPA of 3.1 out of 4.0 to meet the further admission requirements.",Master,Specialisation,February 2025,One-year,21/02/2025,Blended,"Padua, Italy","€4.022,50","€2.822,50",€30,€202,"This one-year master's program focuses on innovation, design, and assessment of service policies within the framework of the 2030 Agenda.  It equips public and private sector professionals with the skills to address challenges related to the Recovery and Resilience Plan. The curriculum covers public asset management, collaborative governance, human resource development, policy assessment, public value creation using data analysis techniques like text mining, and behavioral techniques (nudges) particularly for sustainable tourism. The program emphasizes a multidisciplinary approach, integrating various perspectives and experiences from diverse contexts.  Students will learn cutting-edge planning approaches like co-design and gamification, alongside policy design principles and tools for sustainable policy assessment.  The program aims to foster cross-sectional work methods, soft skills, and innovative ideas for effective policy design, management, and evaluation within the context of sustainable development and the post-COVID-19 recovery.","The course combines lectures, project work, and single courses.  The core curriculum covers theories of innovation, public value generation, decision-making processes, smart and soft work techniques, nudge techniques, HR assessment, social media and public communication.  A significant portion focuses on the digital transition, covering sustainable innovation, technology in information and service innovation, big and open data management, privacy law, AI applications, and cognitive processes in innovation ecosystems.  The evaluation component explores social impact analysis, participatory evaluation, risk assessment, user satisfaction, and cost-benefit analysis.  Single courses are offered in areas like nudging in public policies, public database textual analysis, 2030 Agenda policy assessment, personnel assessment, and integrated cost-benefit analysis for policy sustainability.","The program's curriculum is structured across a single year and covers a comprehensive range of topics, beginning with foundational theories on innovation, public value creation, and decision-making processes. Students delve into smart and soft work approaches in both public and private sectors and learn to implement nudge techniques to enhance policy and service effectiveness.  Furthermore, the program tackles vital areas like human resource assessment, organizational innovation strategies, social media's role in public communication, and the values, strategies, and tools of sustainable innovation in the context of new technologies.  A crucial component is the analysis of big and open data, along with relevant legal considerations including privacy in big data and the application of AI in public sector contexts.",NA,NA,NA,NA,NA,Policy Advisor,Policy Designer,Policy Evaluator,Innovation Manager,Textual Database Analyst
https://uel.unipd.it/en/masters/pma-medically-assisted-procreation-techniques-and-human-reproductive-sciences/,Second-level short specialisation degree in Medically assisted procreation techniques and human reproductive sciences,Overall 6.5 and higher,Overall 65,80 overall,"To be eligible for this Master's degree, you must possess a Bachelor's degree or an equivalent qualification from a recognized and accredited higher education institution.  Specific curricular requirements may apply. For Pakistani students, acceptable qualifications include a 2-year Bachelor (Pass) followed by a 2-year Master's degree; a 2-year Bachelor (Pass) with a Bachelor of Law (LL.B.); a 2-year Bachelor (Pass) with a 3-year Bachelor of Education; a 3-year Bachelor (Honours); or a 4 or 5-year Professional Bachelor.  A minimum GPA of 3.1 out of 4.0 is also required for Pakistani applicants.",Master,Specialisation,2024/2025,One-year,18/11/2024,Distance learning,Padua,"€3.222,50","€2.022,50",€30,€202,"This one-year Master's program focuses on medically assisted procreation (MAP) techniques and human reproductive sciences.  It equips students with the fundamental skills needed to work in clinics and laboratories involved in MAP practices. The curriculum covers a wide range of topics including diagnosis and treatment of infertility in men and women, ovarian stimulation protocols, psychological counseling for infertile couples, gamete selection in heterologous MAP, fertility preservation, and preimplantation genetic diagnosis. Students will gain practical experience through an internship at a MAP center, working alongside leading experts in the field.","The course is structured to provide a comprehensive understanding of all aspects of medically assisted procreation.  It begins with fundamental principles of diagnosis and management of infertility and moves on to the advanced techniques used in fertility treatments.  Students will learn about various levels of MAP techniques (1st, 2nd, and 3rd level), ovarian stimulation, semen analysis and preparation, in vitro fertilization (IVF), intracytoplasmic sperm injection (ICSI), embryo transfer, cryopreservation, and fertility preservation.  Additional modules explore relevant aspects such as endometriosis, tubal pathologies, ultrasound applications in MAP, hysteroscopy, legal aspects of MAP, and psychological counseling for infertile couples.  The program culminates in a significant internship within a MAP center.","The first year of the program provides a solid foundation in the diagnosis and treatment of male and female infertility, including various MAP techniques such as controlled ovarian stimulation, intrauterine insemination, and artificial insemination.  Students will gain practical experience in oocyte cryopreservation, heterologous insemination, and embryo transfer techniques.  The curriculum also covers related topics such as endometriosis, tubal pathologies, ultrasound applications in infertility diagnosis, hysteroscopy, and legal aspects of MAP procedures.  The first year concludes with an introduction to psychological counseling for infertile couples.",NA,NA,NA,NA,NA,Embryologist,Reproductive Endocrinologist,Infertility Specialist,Andrologist,Genetic Counselor
https://uel.unipd.it/en/masters/pmgi-project-management-and-innovation-management/,PMGI - Project Management and Innovation Management,Overall 6.5 and higher,Overall 65,80 overall,"To be eligible for this Master's degree, you must possess a Bachelor's degree or an equivalent qualification from a recognized and accredited higher education institution.  Specific curricular requirements may apply. For Pakistani students, acceptable qualifications include a 2-year Bachelor (Pass) followed by a 2-year Master's degree; a 2-year Bachelor (Pass) combined with a Bachelor of Law (LL.B.); a 2-year Bachelor (Pass) combined with a 3-year Bachelor of Education; a 3-year Bachelor (Honours); or a 4 or 5-year Professional Bachelor.  A minimum GPA of 3.1 out of 4.0 is also required for Pakistani applicants.",Master,Master,November 2024,One-year,08/11/2024,In-person,Padova,"€5.502,50","€3.322,50",€30,€202,"The PMGI program is a one-year Master's level course focusing on project management and innovation management.  It's designed for professionals with some work experience in business or public organizations, regardless of their background. The course blends theoretical knowledge with practical application, emphasizing the latest project management methods, strategic organizational analysis, leadership development, and innovation strategies.  The program aims to cultivate managerial and entrepreneurial mindsets, equipping students to contribute to business growth.  Graduates will possess strong theoretical and practical expertise to thrive in dynamic administrative and management environments.","The program is structured around five key areas: Project Management Methods (covering PMI approaches, various life cycle phases including Agile, Scrum, XP, Lean, SAFE, and DevOps); Strategy and Organization (including organizational analysis, planning, paradigms, governance, change management, and innovation); Management and Leadership (addressing leadership styles, team management, effective communication, and public speaking); Innovation and Entrepreneurship (focusing on product/service concept creation, Design Thinking, and the Business Innovation Manager role); and Business Economics and Management (covering operational and economic-financial performance, KPIs, financial document analysis, and investment analysis).","The first year of the PMGI program covers all five core areas mentioned above. Students will gain a comprehensive understanding of project management methodologies, organizational strategies, leadership skills, innovation techniques, and business economics.  The curriculum combines theoretical learning with practical application through case studies, simulations, and potentially hands-on projects.  The emphasis throughout the year is on developing both hard skills in project management and soft skills such as leadership and communication.",NA,NA,NA,NA,NA,Project Manager,Innovation Manager,Business Analyst,Program Manager,Management Consultant
https://uel.unipd.it/en/masters/pmme-psychology-of-micro-and-maxi-emergencies/,Master in Psychology of Micro and Maxi Emergencies,Overall 6.5 and higher,Overall 65,80 overall,"To be eligible for admission to a Master's degree, you must have a Bachelor's degree or an equivalent qualification from a recognized higher education institution. The institution should be accredited according to the national accreditation system of the country where it is located, and you should meet any specific curricular requirements for the program. For Pakistani students, the following qualifications are considered eligible for admission to a Master's degree: a 2-year Bachelor (Pass) followed by a 2-year Master's degree, a 2-year Bachelor (Pass) combined with a Bachelor of Law (LL.B.), a 2-year Bachelor (Pass) combined with a 3-year Bachelor of Education, a 3-year Bachelor (Honours), or a 4 or 5-year Professional Bachelor. Additionally, applicants must have a minimum GPA of 3.1 out of 4.0 to meet the further admission requirements.",Master,Master,"November 22, 2024",One-year,22/11/2024,Blended,Padova,"€2,822.50",NA,€30,€202,"The Master in Psychology of Micro and Maxi Emergencies is a one-year program designed to train professionals in managing emergency situations.  The curriculum covers psychobiology of stress and trauma, psychotraumatology, developmental psychotraumatology, stress and trauma evaluation, cultural aspects of emergency response, and deontological considerations.  Students learn various intervention techniques, from first psychological aid and debriefing to cognitive-behavioral interventions and Narrative Exposure Therapy.  The program also explores emergency contexts in various settings, including maxi-emergencies, developmental services, social services, hospitals, and international contexts.  The program emphasizes a multidisciplinary approach, involving professors from various universities and national/international organizations, and includes hands-on practice and real-world case studies.","The Master's program is structured around modules covering key aspects of emergency psychology.  It begins with foundational modules on the psychobiology of stress and trauma, followed by modules focused on psychotraumatology, developmental psychotraumatology, and the evaluation procedures for stress and trauma-related disorders. The curriculum also incorporates modules on risk perception and communication, the cultural impact on emergency response, and ethical and legal aspects. The core of the program consists of modules on practical intervention techniques, including first psychological aid, debriefing and defusing, cognitive-behavioral interventions, and Narrative Exposure Therapy. Finally, the program culminates in modules dedicated to addressing emergencies in various contexts, such as maxi-emergencies, developmental services, social services, hospitals, and international humanitarian settings.","The first year of the Master in Psychology of Micro and Maxi Emergencies covers a comprehensive range of topics. Students begin by studying the psychobiology of stress and trauma, followed by a deep dive into psychotraumatology and stress-related disorders.  Developmental psychotraumatology is explored, emphasizing the impact of family contexts and developmental consequences.  The curriculum then focuses on assessment procedures for stress and trauma, including psychological testing and diagnostic foundations.  Risk perception and communication strategies are taught, along with an analysis of the influence of culture and intercultural communication on emergency response.  Deontological and legal aspects of emergency psychology are also addressed. Finally, the year culminates with extensive training in intervention techniques such as first aid, debriefing, cognitive behavioral interventions, and Narrative Exposure Therapy, along with practical application in different emergency contexts.",NA,NA,NA,NA,NA,Emergency Psychologist,Psychotraumatologist,Crisis Counselor,Disaster Relief Worker,Mental Health Professional
https://uel.unipd.it/en/masters/pnei-psychoneuroendocrinoimmunology-during-pregnancy-and-paediatric-age/,Second-level Short Specialisation Degree in Psychoneuroendocrinoimmunology during Pregnancy and Paediatric Age,Overall 6.5 and higher,Overall 65,80 overall,"To be eligible for this Master's degree, you must possess a Bachelor's degree or an equivalent qualification from a recognized and accredited higher education institution.  Specific curricular requirements may apply. For Pakistani students, acceptable qualifications include a 2-year Bachelor (Pass) followed by a 2-year Master's degree; a 2-year Bachelor (Pass) combined with a Bachelor of Law (LL.B.); a 2-year Bachelor (Pass) combined with a 3-year Bachelor of Education; a 3-year Bachelor (Honours); or a 4 or 5-year Professional Bachelor.  A minimum GPA of 3.1 out of 4.0 is also required for Pakistani applicants.",Master,Specialisation,2024/2025,One-year,29/11/2024,Blended,Padua,"€2.822,50","€1.702,50",€30,€202,"This one-year Master's program focuses on Psychoneuroendocrinoimmunology (PNEI) during pregnancy and the pediatric age.  It integrates psychological and biological systems within a lifespan development framework, exploring the interplay between psychological and biological factors impacting health and disease. The course aims to equip professionals, such as psychologists and doctors, with the knowledge and skills to integrate innovative prevention and treatment models into their practice.  A key focus is on interdisciplinary and multi-professional collaboration, enhancing critical thinking and research abilities.  The curriculum covers PNEI fundamentals, clinical applications in various settings, developmental clinical psychology, perinatal and pediatric medicine, and risk factor assessment and prevention strategies.","The curriculum is divided into several modules.  The Psychoneuroendocrinoimmunology section covers fundamentals, genetics, epigenetics, stress physiology, environmental pathologies, nutrition, physical activity, and stress management. Clinical psychology of development explores cognitive neurosciences, learning neurosciences, psychophysiology, and various developmental clinical issues such as neurodevelopmental problems, trauma, and socio-emotional development.  Perinatal and pediatric medicine modules include pediatrics, child neuropsychiatry, perinatology, and the clinical physiopathology of the first phases of life.  Risk factors and prevention is studied through examining environmental impact on development, genetic response to environmental changes, and the effects of the educational environment. The program emphasizes hands-on learning, research skills, and multi-disciplinary teamwork.","The first year covers a comprehensive study of psychoneuroendocrinoimmunology, incorporating theoretical fundamentals, clinical applications, and research methodologies. Key subjects include genetics and epigenetics, stress physiology, environmental influences on health, nutrition and its role in development, and various aspects of clinical psychology, particularly as it relates to developmental stages and disorders. The course also dives into perinatal and pediatric medicine, covering specific conditions and treatments, risk factor assessment, and preventive healthcare strategies. The emphasis on interdisciplinary approaches and multi-professional collaboration ensures students are well-prepared for diverse career opportunities. ",NA,NA,NA,NA,NA,Clinical Psychologist,Pediatrician,Developmental Psychologist,Health Researcher,Healthcare Consultant
