Course Link,Course Title,Required IELTS Score,Required PTE Score,Required TOEFL Score,Entry Requirement,Education Level,Course Level,Intake,Duration,Start Date,Degree Format,Location/Campus,Annual Tuition Fee,Initial Deposit,Application Fee,Regional Tax Fee,Overview,Course Structure,Year 1,Year 2,Year 3,Year 4,Year 5,Year 6,Career Opportunity 1,Career Opportunity 2,Career Opportunity 3,Career Opportunity 4,Career Opportunity 5
https://uel.unipd.it/en/masters/mcp-management-of-primary-care-long-term-care-from-fragility-to-longevity/,First-level short specialisation degree in Management of primary care – Long Term Care from fragility to longevity,NA,NA,NA,"To be eligible for this Master's degree, you must hold a Bachelor's degree or equivalent from a recognized institution, accredited by the country's national system.  Specific curricular requirements may apply.  For Pakistani students, acceptable qualifications include a 2-year Bachelor (Pass) followed by a 2-year Master's, a 2-year Bachelor (Pass) with a Bachelor of Law (LL.B.), a 2-year Bachelor (Pass) with a 3-year Bachelor of Education, a 3-year Bachelor (Honours), or a 4 or 5-year Professional Bachelor. A minimum GPA of 3.1 out of 4.0 is also needed.",Master,Specialisation,November 2024,One-year,28/11/2024,On Campus,Padua,"€2.626,50","€1.622,50",€30,€202,"This one-year specialization program focuses on the management and coordination of healthcare and social support interventions for individuals and families, particularly those dealing with fragility and aging.  The curriculum integrates medical, legal, and ethical considerations with practical training, preparing professionals for diverse settings like hospitals, nursing homes, and community health services. Students will gain expertise in assessing and managing the needs of fragile patients, including their cognitive and physical decline. A strong emphasis is placed on hands-on experience through traineeships in real-world healthcare environments.","The course is structured to provide a comprehensive understanding of long-term care management.  It begins by framing the phenomenon of fragility, characterizing patient types, and outlining relevant assessment tools and methods.  This foundational knowledge lays the groundwork for subsequent modules covering continuous care, ethical and legal considerations, end-of-life care, and advanced treatment directives. The program incorporates extensive hands-on experience through hospital and social/health care traineeships, guided by dedicated tutors. The program culminates in a project focused on improving organizational care models for patients in need.","The first year of the program encompasses several key modules.  It begins with establishing a solid foundation in understanding fragility in patients, followed by detailed training on methods and tools to asses the cognitive and behavioral aspects of such patients. This sets the stage for modules addressing continuous care in various settings and the medical and legal aspects of patient care, particularly at the end-of-life stage.  The program then delves into practical aspects of nursing, such as vascular access, skin ulcer management, nutritional assessment and pain management.  The final part of the year focuses on professionalizing training, including informed consent, risk management, and infection control.",NA,NA,NA,NA,NA,Healthcare Manager,Care Coordinator,Geriatric Nurse,Long-Term Care Administrator,Social Worker
https://uel.unipd.it/en/masters/mcps-coordination-of-health-professions/,First-level short specialisation degree in Coordination of Health Professions,NA,NA,NA,"Admission requires a Diploma/Bachelor’s Degree in one of the 22 healthcare professions listed in the admission notice, or a Regional School Diploma with a high school diploma/upper secondary school diploma, or equivalent titles.  For Pakistani students, specific equivalent qualifications need to be checked against the university's admission requirements. The university website does not provide specific details about  Pakistan's requirements for this program. ",Master,Specialisation,November 2024,One-year,21/11/2024,On Campus,"Padua, Monselice (PD)","€2.602,50","€1.602,50",€30,€202,"The First-level short specialisation degree in Coordination of Health Professions equips students with the skills to become Health Planning Coordinators, focusing on improving the quality and provision of resources within healthcare companies.  The curriculum covers healthcare management and professional development, fulfilling the requirements of Law no. 43 of 01/02/2006.  Students develop skills in resource coordination, professional quality development, and assessment of organizational productivity.  The program emphasizes autonomy of judgment, communication skills, and the ability to learn and apply methods for project management and continuous quality improvement. The program includes an internship of at least 500 hours.","The course is structured around three thematic areas: Healthcare Management (covering organization, planning, health economics, and financial aspects); Management of Health Professions (including organizational analysis, coordination methods, people management, leadership, and change management); and Responsibility and Coordination (addressing ministerial decrees, collective bargaining agreements, professional responsibility, integration of activities, and legal aspects). Additional modules cover applied professional methodology, motivation theory, bioethics, quantitative methods for evaluation and research, and health planning and programming.  The program also includes seminars with national and international experts and a mandatory internship.","The first year of the program covers a broad range of topics within healthcare management and coordination.  Students will study organizational structures, planning and health economics, management of health professionals, leadership principles, and the legal and ethical responsibilities of coordinators.  Practical applications are emphasized through the mandatory internship, allowing students to apply theoretical knowledge in real-world healthcare settings.  Quantitative methods for evaluation and research are also covered, enhancing analytical skills.  The curriculum is designed to build a solid foundation in healthcare management and coordination principles.",NA,NA,NA,NA,NA,Health Planning Coordinator,Healthcare Coordinator,Service Coordinator,Unit Coordinator,Healthcare Manager
https://uel.unipd.it/en/masters/mcs-science-communication/,Master’s Degree in Science Communication,Overall 6.5,Overall 65,80,"To be eligible for this Master's program, applicants must possess a Bachelor's degree or an equivalent qualification from a recognized institution.  For Pakistani students, acceptable qualifications include a 2-year Bachelor (Pass) followed by a 2-year Master's degree; a 2-year Bachelor (Pass) with a Bachelor of Law (LL.B.); a 2-year Bachelor (Pass) combined with a 3-year Bachelor of Education; a 3-year Bachelor (Honours); or a 4 or 5-year Professional Bachelor.  A minimum GPA of 3.1 out of 4.0 is also required for Pakistani applicants.  The institution granting the Bachelor's degree must be accredited according to the national accreditation system of its country.  Specific curricular requirements may apply depending on the applicant's prior education.",Master,Master,November 2024,One-year,15/11/2024,On Campus,Padua,"€2.625,00","€1.625,00",€30,€202,"The Master's Degree in Science Communication is a one-year program designed to train professionals capable of effectively communicating scientific and technological information across various sectors.  The curriculum blends theoretical knowledge with practical skills, covering aspects like scientific journalism, museum curation, digital communication, and institutional communication. Students learn to adapt their communication styles to different audiences and platforms, ensuring both clarity and rigor. The program emphasizes a multidisciplinary approach, enabling graduates to navigate complex scientific issues and communicate them concisely and effectively. The program's goal is to equip students with the tools to contribute meaningfully to scientific communication in diverse settings.","The Master's program is divided into 12 modules, each encompassing several units. Module 1 introduces statistical methods and data communication in a scientific context. Module 2 provides a hands-on writing workshop. Module 3 focuses on historical and linguistic tools for scientific communication. Modules 4-7 cover earth sciences, life sciences, technology, and basic sciences, respectively. Module 8 addresses communication through exhibits and museums. Module 9 delves into digital communication and social media management. Module 10 focuses on institutional communication strategies. Module 11 teaches scientific communication for radio, TV, and new media. Finally, Module 12 covers scientific journalism, addressing aspects such as storytelling, ethics, and combating misinformation. The program also includes 200 hours of traineeships at affiliated institutions.","The first year of the Master's program covers all 12 modules described above.  Students will engage in both theoretical learning and practical application through workshops, visits to museums and scientific facilities, and hands-on projects.  The year culminates in a final dissertation and examination, which incorporates grades from all the modules and traineeship performance.  The modules collectively provide a broad understanding of various aspects of science communication, with a strong focus on practical skills development.",NA,NA,NA,NA,NA,Science Journalist,Science Communicator,Museum Curator,Communications Manager (Research Institution),Social Media Manager (Science/Technology)
https://uel.unipd.it/en/masters/mdm-mountain-medicine/,Post-Graduate Course in Mountain Medicine,NA,NA,NA,"To be eligible for this Post-Graduate Course in Mountain Medicine, applicants must hold one of the following qualifications: a Degree in Medicine and Surgery; a Degree in Dentistry and Dental Prosthetics; a College Nursing Diploma; a College Diploma in Nursing Sciences; a Bachelor’s Degree in Healthcare, Nursing, or Obstetrics; a Specialization/Master’s Degree in Nursing or Obstetrics; or a Regional Nursing Diploma along with a high school diploma/level two secondary school state exam.  University students can apply if they obtain the required degree before the course begins.  While no specific physical abilities are mandatory, those with limitations hindering practical activities can enroll as listeners, attending only theoretical sessions. For Pakistani students, specific equivalent qualifications need to be verified against the university's admission criteria for Master's programs.  This may involve demonstrating equivalent educational levels and potentially meeting GPA requirements.",Master,Master,"November 30, 2024",One-year,30/11/2024,In-person,"Bressanone (BZ), Province of Belluno","€1.472,50",NA,€30,€40.50,"The Post-Graduate Course in Mountain Medicine is a one-year program designed to equip healthcare professionals with the theoretical and practical skills needed to address medical issues in mountainous environments and high altitudes. The course covers a wide range of topics, including high-altitude physiology, altitude-related pathologies (such as altitude sickness, pulmonary, and cerebral edema), thermoregulation, cold-related illnesses, mountain rescue techniques, avalanche safety, trauma management, and mountain-specific medical emergencies.  Students will gain expertise in the treatment of injuries sustained in mountaineering activities and learn how to manage pre-existing conditions in the context of mountain environments. The program emphasizes hands-on learning through practical sessions conducted with qualified professionals in various locations.  The program's objectives are to produce competent medical practitioners capable of working effectively in alpine rescue, mountain area rescue services, or as healthcare professionals during high-altitude expeditions. The program also aims to cultivate contacts and encourage further research in this specialized field.","The course is structured into eight modules, delivered through three intensive one-week sessions held in different locations (Bressanone, Arabba, and Sesto).  Module 1 introduces the mountain environment, including physical variables, meteorology, topography, and rescue techniques. Module 2 focuses on avalanches, covering aspects like hypothermia, rescue methods, and medical treatment. Module 3 explores high-altitude physiology, encompassing adaptations in various body systems. Module 4 examines high-altitude effects on pre-existing pathologies, considering pediatric and geriatric implications. Module 5 delves into high-altitude physiopathology, addressing altitude sickness and its severe forms.  Module 6 covers general mountain medicine, encompassing various pathologies, nutrition, and legal aspects.  Module 7 concentrates on mountain trauma, including resuscitation and first aid techniques. Finally, Module 8 involves updates and competence verification, including remote learning sessions.  The practical component involves hands-on training in climbing, rescue, and alpine techniques, conducted with experienced mountain doctors, guides, and rescue team members.","The one-year Post-Graduate Course in Mountain Medicine covers various aspects of mountain medicine during three intensive one-week sessions and some online lessons. The curriculum includes modules on mountain environment and rescue techniques, avalanche medicine and snow science, high altitude physiology and pathologies, medical considerations for individuals with pre-existing conditions in the mountains, treatment and prevention of altitude sickness, general mountain medicine aspects like nutrition and legal considerations, trauma management in mountain settings, and updates of acquired competencies. Practical sessions focus on hands-on training in alpine and rescue techniques, guided by qualified personnel.",NA,NA,NA,NA,NA,Mountain Rescue Doctor,Alpine Rescue Team Member,Expedition Doctor,Mountain Medicine Specialist,Mountain Area Rescue Service Professional
https://uel.unipd.it/en/masters/medpe-perinatal-medicine-and-intensive-neonatal-care/,Second-level Short Specialisation Degree in Perinatal Medicine and Intensive Neonatal Care,NA,NA,NA,"To be eligible for this Master's degree, you must possess a Bachelor's degree or an equivalent qualification from a recognized and accredited higher education institution.  Specific curricular requirements may apply. For Pakistani students, acceptable qualifications include a 2-year Bachelor (Pass) followed by a 2-year Master's degree; a 2-year Bachelor (Pass) with a Bachelor of Law (LL.B.); a 2-year Bachelor (Pass) with a 3-year Bachelor of Education; a 3-year Bachelor (Honours); or a 4 or 5-year Professional Bachelor.  A minimum GPA of 3.1 out of 4.0 is also required for Pakistani applicants.",Master,Specialisation,"November 11, 2024",One-year,11/11/2024,On Campus,Padua,"€2.672,50","€1.672,50",€30,€202,"The Second-level Short Specialisation Degree in Perinatal Medicine and Intensive Neonatal Care is a one-year program designed to train doctors in neonatology and intensive neonatal care.  The curriculum integrates theoretical instruction using evidence-based medicine (EBM) with extensive hands-on clinical experience in specialized hospital wards.  Students will develop expertise in fetal and neonatal physiology and pathophysiology, emergency response techniques, diagnosis of acute neonatal conditions, management of organ system failures, neonatal transport medicine, and global newborn care programs focusing on chronic diseases and psychomotor development.  The program prepares graduates for leadership roles in perinatal and neonatal care.","The course covers a wide range of topics, including perinatal medicine, neonatology, neonatal care, pediatric cardiology, pediatric surgery, infectious diseases, pediatric nephrology, pediatric pneumology, pediatric radiology, pediatric neurology, brain scans, neurophysiology, neonatal transport medicine, pain therapy, and intensive neonatal care.  The teaching methodology includes lessons, workshops, practical sessions, seminars, expert testimonies, internships, project work, and a final exam.  Internships are conducted in various wards (intensive neonatal care, pathology, pediatric surgery, and maternity clinic) under the supervision of university professors and medical directors.  Additional components include seminars, ward activities, individual study, and participation in Delivery Room Resuscitation Courses.","The entire program is completed within one year.  The curriculum integrates theoretical and practical training.  Students receive instruction in perinatal and neonatal physiology and pathophysiology, diagnosing and treating acute neonatal conditions, managing organ system failures, neonatal transport, and comprehensive newborn care (including chronic diseases, psychomotor development, and vital function support).  Clinical work includes rotations through intensive neonatal care, pathology, pediatric surgery, and maternity clinic wards, all under the guidance of experienced professionals.  The program culminates in a final exam.",NA,NA,NA,NA,NA,Medical Director in Pediatrics/Neonatology,Neonatologist,Intensive Care Neonatologist,Pediatric Physician,Neonatal Transport Specialist
https://uel.unipd.it/en/masters/meta-principles-and-practice-of-systematic-reviews-and-meta-analysis-in-the-biomedical-field/,Master in Principles and Practice of Systemic Reviews and Meta-Analysis in the Biomedical Field,Overall 6.5 and higher,Overall 65,80 overall,"To be eligible for this Master's degree, you must possess a Bachelor's degree or an equivalent qualification from a recognized and accredited higher education institution.  Specific curricular requirements may apply. For Pakistani students, acceptable qualifications include a 2-year Bachelor (Pass) followed by a 2-year Master's degree; a 2-year Bachelor (Pass) with a Bachelor of Law (LL.B.); a 2-year Bachelor (Pass) with a 3-year Bachelor of Education; a 3-year Bachelor (Honours); or a 4 or 5-year Professional Bachelor.  A minimum GPA of 3.1 out of 4.0 is also required for Pakistani applicants to meet further admission requirements.",Master,Master,November 2024,One-year,02/12/2024,Online,Padua,"€3.022,50","€2.022,50",€30,€202,"This Master's program focuses on the principles and practices of systematic reviews and meta-analysis within the biomedical field.  It equips professionals with the skills to design, conduct, and analyze systematic reviews for evidence-based healthcare questions, emphasizing methodological and processing reproducibility.  The curriculum covers classical systematic review methodology, integrating innovative text mining and machine learning applications.  Meta-analysis is explored extensively, from basic methods to advanced multilevel and multivariate models, including network meta-analysis. The course utilizes the R software for practical application and emphasizes the quality of empirical evidence through ethical principles and real-world evidence constructs.  Reproducibility is a core theme, addressing aspects from technical to methodological and scientific reproducibility. Literate programming is also taught using R Markdown.","The Master's program comprises five modules delivered online on-demand.  Module 1 covers systematic review methodology, from protocol development to critical evaluation and reporting.  Module 2 introduces text mining and machine learning applications in systematic reviews, showcasing their use in optimizing resources and time. Module 3 provides an introduction to meta-analysis methodology, focusing on effect measurements, managing heterogeneity between studies, and practical applications.  Module 4 delves into advanced meta-analysis methods, including multi-varied/multi-level models, Bayesian meta-analysis, and network meta-analysis. Finally, Module 5 addresses research reproducibility from quantitative, processing, epidemiological, and philosophical science perspectives.","The Master's program is a one-year program.  The first year covers five modules, focusing on systematic review methodology, text mining and machine learning applications for systematic reviews, meta-analysis methodology (both introductory and advanced), and research reproducibility. Students will learn to conduct systematic reviews from protocol design to reporting, utilizing both classical methods and advanced tools like text mining and machine learning.  They will also gain expertise in various meta-analysis techniques, including advanced models, and understand the importance and various aspects of ensuring research reproducibility.",NA,NA,NA,NA,NA,Systematic Review Specialist,Meta-Analyst,Biomedical Researcher,Data Scientist (Biomedical),Healthcare Analyst
https://uel.unipd.it/en/masters/mfui-myofascial-ultrasound-imaging/,Post-Graduate Course in Myofascial Ultrasounds,Overall 6.5 and higher,Overall 65,80 overall,"To be eligible for admission to a Master's degree, you must have a Bachelor's degree or an equivalent qualification from a recognized higher education institution. The institution should be accredited according to the national accreditation system of the country where it is located, and you should meet any specific curricular requirements for the program. For Pakistani students, the following qualifications are considered eligible for admission to a Master's degree: a 2-year Bachelor (Pass) followed by a 2-year Master's degree, a 2-year Bachelor (Pass) combined with a Bachelor of Law (LL.B.), a 2-year Bachelor (Pass) combined with a 3-year Bachelor of Education, a 3-year Bachelor (Honours), or a 4 or 5-year Professional Bachelor. Additionally, applicants must have a minimum GPA of 3.1 out of 4.0 to meet the further admission requirements.",Master,Master,2024/2025,One-year,25/11/2024,Blended,Padua,"€1.522,50",NA,€30,€202,"The Post-Graduate Course in Myofascial Ultrasounds is a one-year master's program designed to provide students with a comprehensive understanding of myofascial ultrasound imaging techniques. The course covers theoretical and practical aspects of myofascial anatomy, ultrasound principles, advanced scanning techniques, and image interpretation.  It aims to equip students with the skills needed for accurate diagnosis and treatment of musculoskeletal conditions related to myofascial alterations. The curriculum blends classroom learning, hands-on sessions using cadavers and volunteers, and a final project.  Graduates will be proficient in advanced ultrasound imaging, capable of identifying various myofascial pathologies, and possess a thorough understanding of myofascial anatomy and its clinical implications.  The program is suitable for graduates in Medicine and Surgery seeking advanced training in musculoskeletal sonography.","The course is structured into seven modules. Module 1 and 2 focus on myofascial dissection anatomy of muscles and fasciae throughout the body. Module 3 delves into myofascial ultrasound anatomy, covering various regions and the relationship between nerves, fascia, and muscles. Modules 4 and 5 concentrate on practical myofascial ultrasound examination and treatment techniques, including ultrasound-guided injections and other invasive procedures. Module 6 compares myofascial ultrasound with other imaging modalities such as MRI and CT scans. Finally, Module 7 explores the anatomical relationship between nerves, fascia, and muscles, including fascia innervation.  The course culminates in a final project examining various aspects of myofascial anatomy, ultrasound, and pathology.","The first year of the Post-Graduate Course in Myofascial Ultrasounds is comprehensive, covering myofascial anatomy through dissection and ultrasound imaging techniques in the upper and lower limbs, trunk, head, and neck. Students learn advanced scanning protocols, image interpretation, and the application of ultrasound in diagnosing and treating musculoskeletal pathologies. They also gain experience in ultrasound-guided injections, and study the relationship between nerves, muscles and fasciae. The year concludes with a final dissertation on a clinical case.",NA,NA,NA,NA,NA,Musculoskeletal Sonographer,Physical Therapist,Rehabilitation Specialist,Orthopedic Physician,Sports Medicine Physician
