Course Link,Course Title,Required IELTS Score,Required PTE Score,Required TOEFL Score,Entry Requirement,Education Level,Course Level,Intake,Duration,Start Date,Degree Format,Location/Campus,Annual Tuition Fee,Initial Deposit,Application Fee,Regional Tax Fee,Overview,Course Structure,Year 1,Year 2,Year 3,Year 4,Year 5,Year 6,Career Opportunity 1,Career Opportunity 2,Career Opportunity 3,Career Opportunity 4,Career Opportunity 5
https://uel.unipd.it/en/masters/af-pathology-biomechanics-and-therapeutic-treatment-of-the-ankle-and-foot/,"First-level Short Specialisation Degree in Pathology, Biomechanics and Therapeutic Treatment of the Ankle and Foot",6.5,65,80,"For admission to this Master's degree, a Bachelor's degree or equivalent from a recognized institution is required.  The institution must be accredited according to its national system. Specific curricular requirements may apply.  For Pakistani students, eligible qualifications include a 2-year Bachelor (Pass) with a 2-year Master's, a 2-year Bachelor (Pass) combined with a Bachelor of Law (LL.B.), a 2-year Bachelor (Pass) with a 3-year Bachelor of Education, a 3-year Bachelor (Honours), or a 4 or 5-year Professional Bachelor. A minimum GPA of 3.1 out of 4.0 is also needed.",Master,Specialisation,2024,One-year,13/12/2024,In-person,Padua,"€2.822,50","€1.822,50",€30,€202,"This specialized Master's program focuses on the pathology, biomechanics, and therapeutic treatment of ankle and foot conditions.  It aims to equip professionals with comprehensive diagnostic and treatment skills for a wide range of pathologies, from simple to complex, congenital to acquired, and benign to malignant. The curriculum covers anatomy, biomechanics, cancer-related foot and ankle issues, traumatology, prosthetics, various district pathologies, tendinopathies, ligament injuries, neurological and rheumatological conditions, orthoplastics, physical and rehabilitative medicine, bio-orthopaedics, diabetic foot care, orthotics and podiatry, nursing management, and diagnostic radiology. The program is designed for specialized doctors, trainee specialists, nurses, physiotherapists, and podiatrists.","The course provides in-depth training across various domains.  Anatomy includes systematic, topographic, and surgical aspects, along with physiology and physiopathology. Biomechanics focuses on principles related to healthy and pathological foot and ankle tissues.  The curriculum addresses cancer epidemiology, pathological anatomy, and treatment of neoplasms.  Traumatology covers surgical techniques, complications, and arthrodesis procedures.  Prosthetic components explore innovative technical aspects of instruments and models.  District pathologies cover diseases of the forefoot, midfoot, and backfoot.  Tendinopathies and ligament injuries are discussed alongside their treatment.  Neurological and rheumatological foot conditions are analyzed, and orthoplastics covers plastic surgery techniques.  Physical and rehabilitative medicine aspects are integrated, and bio-orthopaedics addresses biological treatment solutions.  Diabetic foot prevention and treatment are covered, as are orthotics and podiatry, including orthosis technique principles.  Nursing management focuses on pre-, intra-, and post-surgical care. Finally, diagnostic radiology explores radiological and ultrasound techniques.","The first year of this master's program covers a comprehensive curriculum encompassing systematic, topographic, and surgical foot and ankle anatomy. It delves into foot and ankle physiology and physiopathology, exploring the principles of biomechanics and bioengineering of both healthy and pathological tissues. The program also extensively covers cancer epidemiology, pathological anatomy, diagnosis, and treatment of benign and malignant neoplasms of the foot and ankle.  Additionally, students will study the indications, surgical techniques, and complications of major foot and ankle traumas, arthrodesis, and saving procedures.  This year will also cover innovative technical aspects of instruments and prosthetic models for foot and ankle joints.",NA,NA,NA,NA,NA,Orthopedic Surgeon,Podiatrist,Physical Therapist,Rehabilitation Specialist,Sports Medicine Physician
https://uel.unipd.it/en/masters/acams-clinical-anatomy-of-the-musculoskeletal-system/,ACAMS - Clinical Anatomy of the Musculoskeletal System,NA,NA,NA,"To be eligible for this Master's degree, applicants must possess a Bachelor's degree or equivalent qualification from a recognized and accredited higher education institution.  Specific curricular requirements may apply.  For Pakistani students, acceptable qualifications include a 2-year Bachelor (Pass) followed by a 2-year Master's degree; a 2-year Bachelor (Pass) with a Bachelor of Law (LL.B.); a 2-year Bachelor (Pass) with a 3-year Bachelor of Education; a 3-year Bachelor (Honours); or a 4 or 5-year Professional Bachelor.  A minimum GPA of 3.1 out of 4.0 is also required for Pakistani applicants.",Master,Master,2024/2025,One-year,09/12/2024,In-person,Padua,€672.50,NA,€30,€202,"The ACAMS course focuses on the clinical anatomy of the musculoskeletal system, bridging anatomical knowledge with clinical applications.  It aims to equip healthcare professionals with advanced skills in identifying and assessing clinical and medico-legal issues related to musculoskeletal injuries and pathologies. The program integrates anatomical and pathological aspects, diagnostic imaging techniques, damage assessment methods, and rehabilitation and surgical approaches.  It is designed to improve the understanding of physiopathological processes leading to death, the identification of medical errors, and the estimation of damages, particularly in complex multi-factor pathologies.","The course is modular, covering key areas in musculoskeletal anatomy, diagnostics, treatment, and medico-legal aspects. Modules include medical anatomy of the musculoskeletal system (osteology, arthrology, myology); clinical, instrumental, and laboratory diagnostic techniques, including diagnostic imaging; fundamentals of rehabilitation and surgical treatment (physiatry, orthopedics, reconstructive surgery, surgical anatomy); implications of occupational medicine, workplace ergonomics, and damage assessment; forensic discussions through case reports, clinical cases, and role-playing; and clinical and surgical anatomy updates. Hands-on dissection practice is also included.","The one-year course encompasses modules on medical anatomy of the musculoskeletal system (including osteology, arthrology, and myology), diagnostic imaging and other clinical diagnostic methods, the basis of pathological and medical treatments, physical and surgical treatments (including physiatry, orthopedics, reconstructive surgery, and surgical anatomy), occupational medicine (ergonomics and damage assessment), and forensic analysis through case studies and role-playing.  The year also includes practical sessions involving dissections to enhance practical understanding.",NA,NA,NA,NA,NA,Medical Examiner,Orthopedic Surgeon,Physiatrist,Radiologist,Sports Medicine Physician
https://uel.unipd.it/en/masters/acf-accounting-corporate-finance/,Master's Degree in Accounting & Corporate Finance,NA,NA,NA,"To be eligible for admission to this Master's degree, you must hold a Bachelor's degree or equivalent qualification from a recognized higher education institution.  The institution must be accredited according to its national accreditation system.  Specific curricular requirements may apply. For Pakistani students, eligible qualifications include a 2-year Bachelor (Pass) followed by a 2-year Master's degree, a 2-year Bachelor (Pass) with a Bachelor of Law (LL.B.), a 2-year Bachelor (Pass) with a 3-year Bachelor of Education, a 3-year Bachelor (Honours), or a 4 or 5-year Professional Bachelor.  A minimum GPA of 3.1 out of 4.0 is also required for Pakistani students.  Students without a background in economics can still apply. There is a mandatory 16-hour accounting course for those lacking a relevant BA or work experience.",Master,Master,2024/2025,One-year,22/11/2024,Blended,Padua,"€5.522,50","€3.522,50",€30,€202,"The Master's Degree in Accounting & Corporate Finance is a one-year program taught in Italian.  It's designed for professionals in administration, finance, and control who want to update their skills, recent graduates seeking advanced knowledge, and those without a finance background wanting to transition careers. The program focuses on financial statements, corporate finance, and performance audits, using a blend of theory, practice, case studies, and lectures.  The curriculum emphasizes developing tools and concepts relevant to the sector, ultimately training students to become effective business partners within their organizations.  The program aims to equip students with advanced skills to excel in roles such as junior and senior controllers, administrative directors, corporate consultants, performance audit managers, and CFOs.  This professional master's degree prepares graduates for success in a variety of corporate settings. The program is highly practical, and includes hands-on experience with data analysis tools to support decision making.","The course is structured around three thematic areas: Financial Statements, covering the drafting and interpretation of standard and consolidated financial statements, international accounting principles, and risk management; Performance Audit, encompassing corporate planning analysis, cost analysis, budgeting, transfer pricing, and multidimensional performance analysis systems; and Corporate Finance, analyzing capital budgeting, corporate evaluation, extraordinary growth finance, and big data and business analytics.  The curriculum also includes an initial mandatory accounting course (16 hours) for those without prior relevant education or experience. The program incorporates workshops on SAP, advanced Excel, and Tableau, providing practical skills in data analysis and reporting software. The program provides a blend of theory and practice, using cases studies and lectures in addition to traditional classes.","The first year of the Master's Degree in Accounting & Corporate Finance covers a wide range of topics across accounting, finance, and control. Students will master financial statement drafting and interpretation, including both national and international accounting principles (IFRS).  Key subjects include investment analysis, planning and control (budgeting, variance analysis, and cost analysis), consolidated financial statements, strategic control, strategic planning, big data analytics, managing bank relationships and corporate rating optimization, risk management, and corporate governance. Students will learn about corporate assessment, extraordinary finance, cash management, listing on regulated markets, private equity, corporate taxation, transfer pricing, and anti-laundering and fraud prevention. The year culminates in a final project, optionally including an internship.",NA,NA,NA,NA,NA,Junior Controller,Senior Controller,Administrative Director,Corporate Consultant,CFO
https://uel.unipd.it/en/masters/angio-angiology/,Second-level short specialisation degree in Angiology,NA,NA,NA,"To be eligible for this Master's degree, you must possess a Bachelor's degree or an equivalent qualification from a recognized and accredited higher education institution.  For Pakistani students, acceptable qualifications include a 2-year Bachelor (Pass) followed by a 2-year Master's degree, a 2-year Bachelor (Pass) with a Bachelor of Law (LL.B.), a 2-year Bachelor (Pass) with a 3-year Bachelor of Education, a 3-year Bachelor (Honours), or a 4 or 5-year Professional Bachelor.  A minimum GPA of 3.1 out of 4.0 is also required.  The university does not specify any additional standardized test score requirements like GRE, GMAT, or specific subject prerequisites beyond the general Bachelor's degree requirement.",Master,Specialisation,November 2024,One-year,11/11/2024,Blended,Padua,"€3.522,50","€2.122,50",€30,€202,"The Second-level short specialisation degree in Angiology is a one-year program designed for healthcare professionals such as cardiologists, vascular surgeons, internists, and general practitioners.  The course focuses on providing advanced theoretical and practical training in medical angiology, with a strong emphasis on Doppler Ultrasound and non-invasive diagnostic methods.  Students will gain expertise in evaluating and treating patients with various arterial and venous vascular conditions.  The curriculum integrates theoretical knowledge with hands-on experience through a significant clinical traineeship at the Padua Hospital, working alongside experienced specialists.  The program aims to develop independent practitioners capable of accurate diagnosis, treatment planning, and patient follow-up.","The Angiology specialisation program combines theoretical learning with a substantial practical component. The theoretical section includes video lessons delivered asynchronously via the Moodle platform, supplemented by synchronous Zoom sessions. This theoretical component covers the standardized procedures and applications of Doppler Ultrasound and other non-invasive diagnostic methods for arterial and venous-lymphatic vascular conditions. This also includes an in-depth understanding of the pathophysiology of various vascular diseases and the different diagnostic study sectors with the aforementioned non-invasive methods.   The practical component consists of a 250-hour traineeship at the Padua Hospital, under the guidance of experienced tutors.  Students actively participate in the clinical diagnostic pathway of patients with vascular disease, from initial assessment and Doppler Ultrasound execution to treatment and follow-up. The course culminates in the submission of an individual research paper on a chosen topic, presented before a committee.","The first and only year of the Angiology specialisation includes a comprehensive blend of theoretical and practical training.  The theoretical component covers the principles of Doppler Ultrasound, non-invasive diagnostic methods, and the pathophysiology of various vascular diseases.  Specific topics include the diagnostic study of supra-aortic trunks, neck venous vessels, upper and lower limb arterial and venous vessels, and abdominal vessels. Students learn how to apply these methods in a clinical setting, including selecting appropriate quantitative and qualitative measures.  The 250-hour traineeship involves hands-on experience in the clinical setting under the direct supervision of experienced professionals. Students will gain experience in assessing patients' medical history, performing Doppler Ultrasound examinations, and managing the follow-up care for patients with vascular diseases. This intensive practical work is vital in supplementing and building on the theoretical content learned throughout the course.",NA,NA,NA,NA,NA,Cardiologist,Vascular Surgeon,Internist,General Practitioner,Angiologist
https://uel.unipd.it/en/masters/appa-pedagogical-action-and-psycho-educational-interventions-to-promote-the-adult-life-of-people-with-autism/,Post-Graduate Course in Pedagogical Action and Psycho-Educational Interventions to Promote the Adult Life of People with Autism,NA,NA,NA,"To be eligible for this Master's degree, applicants must possess a Bachelor's degree or an equivalent qualification from a recognized and accredited higher education institution.  Specific curricular requirements may apply.  For Pakistani students, acceptable qualifications include a 2-year Bachelor (Pass) followed by a 2-year Master's degree; a 2-year Bachelor (Pass) with a Bachelor of Law (LL.B.); a 2-year Bachelor (Pass) with a 3-year Bachelor of Education; a 3-year Bachelor (Honours); or a 4 or 5-year Professional Bachelor.  A minimum GPA of 3.1 out of 4.0 is also required for Pakistani applicants.",Master,Master,"November 11, 2024",One-year,11/11/2024,Blended,Padova,"€1.272,50",NA,€30,€202,"This postgraduate course equips professionals with the skills to support autistic individuals and their families in building independent adult lives. The program focuses on fostering social inclusion, particularly for those at risk of isolation after completing school.  Key areas of study include pedagogical approaches to disabilities, developing individualized life projects based on the ICF model, understanding communication and language in autism, and promoting collaboration among professionals. The course aims to enhance the independence of autistic adults by improving their social, relational, communication, and work-related skills.","The curriculum covers various aspects of supporting autistic adults, beginning with a multidimensional assessment framework using the ICF model.  Medical aspects include diagnosis, functional profiles, and communication/language characteristics, encompassing alternative augmentative communication strategies. Educational components cover the transition from school to adult life, including personal life project planning and the integration of the PCTO (Percorsi per le Competenze Trasversali e per l'Orientamento) approach.  The course also explores psychological and educational support during adolescence and adulthood, encompassing self-determination, communication, work, relationships, and community welfare. Legal frameworks for protecting vulnerable individuals are also addressed.","The first year of the program integrates medical, pedagogical, and psycho-educational approaches to support autistic adults. Students explore the ICF framework for assessment, delve into the characteristics of autism across the lifespan, and examine various communication strategies, including augmentative communication methods.  They will also develop skills in creating personalized life plans, supporting school-to-work transitions and considering legal and ethical concerns associated with working with vulnerable populations.",NA,NA,NA,NA,NA,Educational Specialist,Autism Support Worker,Psycho-Educational Consultant,Special Needs Teacher,Behavioral Therapist
https://uel.unipd.it/en/masters/ars-andrology-reproduction-and-sexuality/,"Master in Andrology, Reproduction and Sexuality",Overall 6.5,Overall 65,80 overall,"To be eligible for this Master's degree, you must hold a Bachelor's degree or equivalent from a recognized institution, accredited by your country's national system.  Specific curricular requirements may apply.  For Pakistani students, acceptable qualifications include a 2-year Bachelor (Pass) followed by a 2-year Master's degree; a 2-year Bachelor (Pass) combined with a Bachelor of Law (LL.B.); a 2-year Bachelor (Pass) combined with a 3-year Bachelor of Education; a 3-year Bachelor (Honours); or a 4 or 5-year Professional Bachelor. A minimum GPA of 3.1 out of 4.0 is also required.",Master,Master,November 2024,One-year,20/11/2024,In-person,Padua,"€3.522,50","€2.122,50",€30,€202,"The Master in Andrology, Reproduction and Sexuality is a one-year, in-person program focusing on the biological, genetic, embryological, psychological, nutritional, and diagnostic aspects of reproductive physiopathology.  It covers clinical andrology, endocrine deficiencies, sexually transmitted diseases, and gender inconsistencies. The curriculum caters to various professionals, including doctors, biologists, biotechnologists, chemists, psychologists, and nutritionists, offering specialized training in their respective fields.  The program aims to provide students with the skills to perform clinical, care, and research activities in reproductive medicine settings.","The Master's program integrates classroom learning, laboratory practice, and internships.  The curriculum encompasses andrology aspects in metabolic and thyroid pathologies; seminology, embryology, and cryobiology of gametes; urological diseases in andrology; endocrinology and genetics in andrology; reproductive biotechnologies; physiopathology of male infertility; gender and sexual medicine; microbiology and virology in human reproduction; clinical and experimental andrology; instrumental diagnosis in andrology; medically assisted procreation techniques; diagnostics and treatment of urogenital tract diseases; endocrine and infective diseases in medically assisted procreation techniques; gametes and embryo culture methods; metabolic diseases as a cause of infertility and sexual dysfunctions; testicle cytology and male infertility treatments; nutrition and food supplements in infertility and sexuality; and medically assisted procreation techniques with cryopreserved and donated gametes.  The program also incorporates psychological aspects of sexuality, reproduction, and gender identity.","The first year of the Master in Andrology, Reproduction and Sexuality program is a comprehensive exploration of andrology, reproduction, and sexuality.  Students delve into the biological, genetic, and clinical aspects of male and female reproductive systems, including endocrine disorders, infertility, sexually transmitted infections, and gender-related issues.  Laboratory work, clinical rotations, and hands-on experience in medically assisted procreation techniques are integral parts of the curriculum.  Topics like gamete cryopreservation, reproductive biotechnologies, and psychological aspects of sexual health are studied in depth. The course culminates in an internship where students gain practical experience in a clinical or research setting.",NA,NA,NA,NA,NA,Andrologist,Reproductive Endocrinologist,Reproductive Biologist,Sexual Health Therapist,Fertility Specialist
https://uel.unipd.it/en/masters/assie-nursing-care-in-intensive-and-emergency-areas/,First-level short specialisation degree in Nursing Care in Intensive and Emergency Areas,NA,NA,NA,"The First-level short specialisation degree is designed for professional nurses holding a Bachelor’s Degree or equivalent.  Undergraduates graduating in November-December 2023 may also apply conditionally.  For Pakistani students, specific eligibility criteria are not explicitly stated on the provided webpage; however, general master's entry requirements include a Bachelor's degree or equivalent from a recognized institution meeting the national accreditation standards of their country.  The university website provides further details for Pakistani students applying to Master's programs.  This program also has a limited number of participants and uses a score-based selection method considering both titles and years of work experience from the resume, added to the score of the oral exam.",Master,Specialisation,November 2024,Two-year,18/11/2024,On Campus,"Padua, Italy","€2.595,50","€1.625,00",€30,€202,"This two-year, on-campus specialization program focuses on advanced nursing care in intensive and emergency settings for adult patients.  The curriculum integrates classroom learning with hands-on workshops, simulations, and a significant clinical traineeship.  The course emphasizes the development of advanced skills in airway management, ultrasound techniques, hemodynamic monitoring, renal replacement therapy, trauma and brain injury care, and infection control.  Students will also enhance their communication, teamwork, and medical risk management abilities.  The program is designed to equip nurses with the expertise to manage critical situations effectively in various care environments.","The program is structured into three main areas: Cardiac-Respiratory, Specialist, and Law and Research.  The Cardiac-Respiratory area covers non-hospital and ER assistance, respiratory and hemodynamic function monitoring and support. The Specialist area includes neurological and pain management, metabolic and renal function monitoring, pediatric critical care, wound care, thermal regulation, and medical risk management.  The Law and Research area focuses on research methodologies, teamwork, and legal and bioethical considerations in healthcare. The program includes certified courses in Basic Life Support (BLSD), Advanced Cardiovascular Life Support (ACLS), and PreHospital Trauma Life Support (PHTLS), as well as a safety course. A significant part of the program is a 300-hour traineeship in critical care units.","The first year of the program involves 400 hours of intensive classroom learning, encompassing in-person lessons, workshops, and practice sessions in areas such as eco-fast, eco-guided vascular access, airway management, ventilator management, suturing, and BLS/ALS. Students will also begin their 150-hour traineeship focusing on emergency and trauma care, invasive and non-invasive ventilation, vascular access, advanced hemodynamic monitoring, renal replacement therapy, and management of brain-damaged patients.","The second year continues with additional classroom learning, building upon the first year's foundation.  Students will complete the remaining 150 hours of their traineeship, rotating through various critical care units such as intensive care, emergency rooms, and operating rooms to solidify practical skills and theoretical knowledge.  The year culminates in a short project work based on literature review or an improvement project for their operating unit.  They will also complete the certified courses included in the registration fee.",NA,NA,NA,NA,Intensive Care Nurse,Emergency Room Nurse,Trauma Nurse,Critical Care Specialist,Operating Room Nurse
